{"schemaVersion":"cp03-model-bakeoff-approval/0.1","approvalId":"approval_cp03_model_bakeoff_20260824T102203Z","approvedAt":"2026-08-24T10:22:03Z","runId":"cp03-model-bakeoff-20260824T055034Z","planSha256":"670d37426345f536ee6277e39ca0183005d93535e14bfe35eebf74bc80fefc48","preflightSha256":"f5f09458460c453187745861ea0837277008d8b9171f972290393955430355e9","fixtureManifestSha256":"92f94e735e37b51cd0c33e4cd6dd8b6c65b2dbae439aa8bd0f175261090ba524","promptManifestSha256":"1f1e01b41f37b79742ad1b49e3980f2eea2e0480768188f835401c0399cdbbf8","schemaManifestSha256":"831f7c184ac418f15683bccf34b0e21a7b985f789791f1708bf74b4a02a16f16","pricingManifestSha256":"37305376843c7e01d274982b7479c4555df5d048887cf06f91e454787ef0316a","candidates":[{"provider":"deepseek","route":"deepseek-official","model":"deepseek-v4-pro"},{"provider":"deepseek","route":"deepseek-official","model":"deepseek-v4-flash"},{"provider":"gemini","route":"google","model":"gemini-3.5-flash"},{"provider":"gemini","route":"google","model":"gemini-3.6-flash"},{"provider":"gemini","route":"google","model":"gemini-3.7-flash"}],"repetitions":2,"counts":{"intended":28,"eligible":28,"excluded":0,"sent":0,"plannedDispatches":28,"maximumDispatches":30},"inputClasses":["fictional_text","synthetic_spatial_image","synthetic_scene_registry"],"tokenCapsSha256":"7cd6e9fdf328c84c9b6b4cc536db579c947a7f1235e46f5f72bc3fd25dd2b24a","keychainReferencesSha256":"0a106e2edcd36f7a7ceaa2a2159f623007ee1dfe3099c2a8b542e68435b317cd","retrySlots":{"deepseek":1,"gemini":1},"worstCaseEstimatedUsd":0.35545088,"maxUsd":0.5,"oneRunOnly":true,"automaticRerun":false,"externalCapabilities":[]}
